{
 "schema": "trinity.ternary-check.v1",
 "issue": "dmitrii-f-t27/trinity-memory#32",
 "reproduce": "make ternary-check (python3 -m trinity_memory.ternary_check --check compares)",
 "compiler": {
  "repo": "gHashTag/t27",
  "commit": "d06eaedc9fb59cda13c3529e1c6ed5bc510f3e08"
 },
 "fixtures": "fixtures/manifest.json, consumer ternary_check",
 "run_metadata": "excluded: timings and the host of a run are written to build/ternary-check/run.json",
 "comparison": "trits compared value by value; scales compared weight by weight as exact values (an f16 and a bf16 word of the same number are equal)",
 "taxonomy": {
  "cell_status": {
   "match": 0,
   "mismatch": 1,
   "not-representable": 2
  },
  "explanations": {
   "scale_bf16_rounding": {
    "code": 1,
    "text": "every differing scale pair is a bf16 word and an f32 word, and the bf16 word is the f32 word rounded to nearest-even (item 1 of docs/ternary-check.md)"
   },
   "tie_split": {
    "code": 2,
    "text": "every differing trit is at a weight whose bf16 master value is +-0.5 x weight_scale, and the packed checkpoint stores both 0 and +-1 for that value, so no rule applied to the published bf16 values gives the packed trits (item 2 of docs/ternary-check.md)"
   },
   "scale_zero_weights": {
    "code": 3,
    "text": "scales differ only at weights whose trit is 0 in both tensors, so every weight dequantizes to the same value: the llama.cpp TQ1_0/TQ2_0 quantizers store d = 0 for a block of zero weights"
   },
   "unexplained": {
    "code": 4,
    "text": "the difference is not one of the explained patterns"
   }
  },
  "reasons": {
   "shape": {
    "code": 0,
    "unit": "the format's geometry does not tile the tensor's shape"
   },
   "binary_only": {
    "code": 1,
    "unit": "weights equal to 0"
   },
   "code_outside": {
    "code": 2,
    "unit": "weights outside the format's codes"
   },
   "group_scales_differ": {
    "code": 3,
    "unit": "stored scale groups that span reference scales of different values"
   },
   "scale_precision": {
    "code": 4,
    "unit": "reference scale words without an exact word of the format's scale type"
   }
  },
  "provenance": {
   "reference": "the published bytes this tensor's other cells are compared with: third-party evidence",
   "published": "bytes of a pinned public checkpoint, decoded by t27: third-party evidence",
   "t27_round_trip": "written by the t27 encoder and read back by the t27 decoder: shows that the format can hold the tensor; not third-party evidence",
   "upstream_encoder": "written by the pinned llama.cpp reference quantizer from the dequantized tensor, read by the t27 decoder: third-party evidence",
   "not_written": "nothing is written: t27 (tmx_representable) decides from the reference trits and scales that the format cannot hold the tensor, so neither the t27 encoder nor an upstream writer runs; not third-party evidence",
   "derived": "trits computed by t27 from published bf16 master weights with the transformers WeightQuant rule; not a storage format"
  },
  "errors": {
   "format": -50,
   "length": -51,
   "capacity": -52,
   "code": -53,
   "padding": -54,
   "truncated": -55,
   "container": -56,
   "not_found": -57,
   "scale_nonfinite": -58,
   "type_ambiguous": -59,
   "layout_unsupported": -60,
   "misaligned": -61,
   "extent": -62
  },
  "flags": {
   "outside_ternary": 0,
   "noncanonical_base3": 1,
   "scale_negative": 2,
   "scale_zero": 3,
   "trailer_nonzero": 4,
   "padding_nonzero": 5,
   "affine_not_ternary": 6
  },
  "source": "t27/matrix.t27 (TMX_*) and t27/formats.t27 (TF_ERR_*, TF_FLAG_*); specs/formats/OWNERS.md"
 },
 "upstream": {
  "llama.cpp": {
   "repo": "ggml-org/llama.cpp",
   "commit": "4364bf7232e65c34eca8d9500c5464389662de6b",
   "lock": "tests/upstream/llama.cpp.lock.json",
   "files": {
    "ggml/src/ggml-common.h": "0061131b615c5721fc88a78feeb22c1f8c450f1c2646a317d80796a653bf595c",
    "ggml/src/ggml-cpu/arch/arm/quants.c": "a4d3cfdea82b73c0086f63ad9f698e536117a1c25f2f266fc9cd6e7f51deab1b",
    "ggml/src/ggml-cpu/arch/x86/quants.c": "3c489fdc77e3ab484a5f188bff9c60c0e9483c951ed65c1a562a04c249d5628e",
    "ggml/src/ggml-cpu/quants.c": "a61f1011e49d05b5f99d352b158d5b8e36cf008294bb0db309f72bdd7f1d4e35",
    "ggml/src/ggml-quants.c": "7878680cc60493f98469a116e9b14af8b84789292ccf891c249230b2fa3d157f"
   },
   "functions": [
    "ggml/src/ggml-quants.c:621-626",
    "ggml/src/ggml-quants.c:2316-2412",
    "ggml/src/ggml-quants.c:2428-2484"
   ],
   "writer": "tests/upstream/encode_llamacpp_tq.c, built by tests/upstream/run-llamacpp-matrix.sh",
   "input": "w = t * weight_scale in float: t decoded from the HF packed checkpoint by t27, weight_scale its bf16 value (exact in f16); one quantize call per row",
   "applies_to": "BitNet tensors; Bonsai tensors are not representable in TQ1_0 or TQ2_0"
  }
 },
 "formats": [
  {
   "id": "hf_packed",
   "name": "HF packed uint8 + bf16 weight_scale",
   "t27_format": 8,
   "scale_dtype": "BF16",
   "scale_group": 0,
   "group_argument": 0,
   "writer": "t27"
  },
  {
   "id": "i2_s",
   "name": "I2_S (bitnet.cpp)",
   "t27_format": 7,
   "scale_dtype": "F32",
   "scale_group": 0,
   "group_argument": 0,
   "writer": "t27"
  },
  {
   "id": "ptq1_0",
   "name": "PTQ1_0 (PrismML)",
   "t27_format": 6,
   "scale_dtype": "F16",
   "scale_group": 128,
   "group_argument": 0,
   "writer": "t27"
  },
  {
   "id": "pq2_0",
   "name": "PQ2_0 (PrismML)",
   "t27_format": 5,
   "scale_dtype": "F16",
   "scale_group": 128,
   "group_argument": 0,
   "writer": "t27"
  },
  {
   "id": "q2_0",
   "name": "Q2_0, group 64 (llama.cpp)",
   "t27_format": 3,
   "scale_dtype": "F16",
   "scale_group": 64,
   "group_argument": 0,
   "writer": "t27"
  },
  {
   "id": "mlx_2bit",
   "name": "MLX 2-bit affine, group 128",
   "t27_format": 9,
   "scale_dtype": "F16",
   "scale_group": 128,
   "group_argument": 128,
   "writer": "t27"
  },
  {
   "id": "tq1_0",
   "name": "TQ1_0 (llama.cpp)",
   "t27_format": 1,
   "scale_dtype": "F16",
   "scale_group": 256,
   "group_argument": 0,
   "writer": "t27"
  },
  {
   "id": "tq2_0",
   "name": "TQ2_0 (llama.cpp)",
   "t27_format": 2,
   "scale_dtype": "F16",
   "scale_group": 256,
   "group_argument": 0,
   "writer": "t27"
  },
  {
   "id": "q1_0",
   "name": "Q1_0, binary (llama.cpp)",
   "t27_format": 4,
   "scale_dtype": "F16",
   "scale_group": 128,
   "group_argument": 0,
   "writer": "t27"
  },
  {
   "id": "onnx_2bit",
   "name": "ONNX MatMulNBits bits=2, block 128",
   "t27_format": 10,
   "scale_dtype": "F16",
   "scale_group": 128,
   "group_argument": 128,
   "writer": "t27"
  },
  {
   "id": "tq1_0_llamacpp",
   "name": "TQ1_0 by llama.cpp quantize_row_tq1_0_ref",
   "t27_format": 1,
   "scale_dtype": "F16",
   "scale_group": 256,
   "group_argument": 0,
   "writer": "llama.cpp quantize_row_tq1_0_ref"
  },
  {
   "id": "tq2_0_llamacpp",
   "name": "TQ2_0 by llama.cpp quantize_row_tq2_0_ref",
   "t27_format": 2,
   "scale_dtype": "F16",
   "scale_group": 256,
   "group_argument": 0,
   "writer": "llama.cpp quantize_row_tq2_0_ref"
  }
 ],
 "tensors": [
  {
   "id": "bitnet-q_proj",
   "model": "BitNet b1.58 2B4T",
   "family": "bitnet",
   "names": {
    "hf": "model.layers.0.self_attn.q_proj.weight",
    "gguf": "blk.0.attn_q.weight"
   },
   "shape": [
    2560,
    2560
   ],
   "weights": 6553600,
   "reference": {
    "column": "hf_packed",
    "source": [
     {
      "repo": "microsoft/bitnet-b1.58-2B-4T",
      "revision": "04c3b9ad9361b824064a1f25ea60a8be9599b127",
      "file": "model.safetensors",
      "range": [
       672931828,
       674570228
      ]
     },
     {
      "repo": "microsoft/bitnet-b1.58-2B-4T",
      "revision": "04c3b9ad9361b824064a1f25ea60a8be9599b127",
      "file": "model.safetensors",
      "range": [
       656760922,
       656760924
      ]
     }
    ],
    "trits_sha256_le": "6964ba331c4343f47f5ea013545c59ded5517d072e3a5ba7f590490117fa6392",
    "scale": {
     "dtype": "BF16",
     "group": 0,
     "count": 1,
     "first_word": 16284
    }
   }
  },
  {
   "id": "bitnet-down_proj",
   "model": "BitNet b1.58 2B4T",
   "family": "bitnet",
   "names": {
    "hf": "model.layers.0.mlp.down_proj.weight",
    "gguf": "blk.0.ffn_down.weight"
   },
   "shape": [
    2560,
    6912
   ],
   "weights": 17694720,
   "reference": {
    "column": "hf_packed",
    "source": [
     {
      "repo": "microsoft/bitnet-b1.58-2B-4T",
      "revision": "04c3b9ad9361b824064a1f25ea60a8be9599b127",
      "file": "model.safetensors",
      "range": [
       657612788,
       662036468
      ]
     },
     {
      "repo": "microsoft/bitnet-b1.58-2B-4T",
      "revision": "04c3b9ad9361b824064a1f25ea60a8be9599b127",
      "file": "model.safetensors",
      "range": [
       656736848,
       656736850
      ]
     }
    ],
    "trits_sha256_le": "12d119b01166e1e8d77d7bd6027d1bb8d16b70009543e45862c4c814c3eaffee",
    "scale": {
     "dtype": "BF16",
     "group": 0,
     "count": 1,
     "first_word": 16394
    }
   }
  },
  {
   "id": "bonsai-ffn_down",
   "model": "Ternary Bonsai 2 27B",
   "family": "bonsai",
   "names": {
    "gguf": "blk.0.ffn_down.weight",
    "mlx": "language_model.model.layers.0.mlp.down_proj"
   },
   "shape": [
    5120,
    17408
   ],
   "weights": 89128960,
   "reference": {
    "column": "ptq1_0",
    "source": [
     {
      "repo": "prism-ml/Ternary-Bonsai-2-27B-gguf",
      "revision": "6ed5e12bf84b7a63069882c91dd9e9218647d17b",
      "file": "Ternary-Bonsai-2-27B-PTQ1_0.gguf",
      "range": [
       585748832,
       605245792
      ]
     }
    ],
    "trits_sha256_le": "39ab72301bb62a2a6ae07e3586a5afbf04c31203e28186fa92bb4f5eb1a256e1",
    "scale": {
     "dtype": "F16",
     "group": 128,
     "count": 696320,
     "first_word": 8677
    }
   },
   "runtime_requirements": {
    "hadamard_rotation": true,
    "evidence": "every GGUF file of this tensor declares prism.* metadata (prism.hadamard.*)",